{
  "version": "1.0",
  "project_id": "backlot-demo-run",
  "pipeline_type": "cinematic",
  "stage": "research",
  "status": "completed",
  "timestamp": "2026-09-04T04:16:21.035430+00:00",
  "checkpoint_policy": "guided",
  "human_approval_required": false,
  "human_approved": false,
  "artifacts": {
    "research_brief": {
      "version": "1.0",
      "topic": "The Last Lighthouse",
      "research_date": "2026-03-27",
      "landscape": {
        "existing_content": [
          {
            "title": "Existing Video 1",
            "source": "youtube",
            "angle": "tutorial",
            "what_it_covers": "basics"
          },
          {
            "title": "Existing Video 2",
            "source": "blog",
            "angle": "deep dive",
            "what_it_covers": "advanced"
          },
          {
            "title": "Existing Video 3",
            "source": "youtube",
            "angle": "comparison",
            "what_it_covers": "alternatives"
          }
        ],
        "saturated_angles": [
          "basic tutorial"
        ],
        "underserved_gaps": [
          "misconceptions about topic"
        ]
      },
      "data_points": [
        {
          "claim": "73% of users prefer X",
          "source_url": "https://example.com/study",
          "credibility": "primary_source"
        },
        {
          "claim": "Market grew 40% in 2025",
          "source_url": "https://example.com/report",
          "credibility": "secondary_source"
        },
        {
          "claim": "Most experts agree on Y",
          "source_url": "https://example.com/survey",
          "credibility": "primary_source"
        }
      ],
      "audience_insights": {
        "common_questions": [
          "What is X?",
          "How does X work?",
          "Why is X important?"
        ],
        "misconceptions": [
          {
            "myth": "X is slow",
            "reality": "X is fast"
          }
        ],
        "knowledge_level": "Beginner to intermediate"
      },
      "angles_discovered": [
        {
          "name": "The Surprising Truth",
          "hook": "You think X is slow. It's not.",
          "type": "contrarian",
          "why_now": "New benchmark data",
          "grounded_in": [
            "data_point_1"
          ]
        },
        {
          "name": "X From Scratch",
          "hook": "Build X in 5 minutes.",
          "type": "evergreen",
          "why_now": "Audience demand",
          "grounded_in": [
            "audience_q1"
          ]
        },
        {
          "name": "Why X Matters Now",
          "hook": "X just changed everything.",
          "type": "trending",
          "why_now": "Recent announcement",
          "grounded_in": [
            "trending_1"
          ]
        }
      ],
      "sources": [
        {
          "url": "https://example.com/study",
          "title": "Study on X",
          "used_for": "data_points"
        },
        {
          "url": "https://example.com/report",
          "title": "Market Report",
          "used_for": "data_points"
        },
        {
          "url": "https://example.com/survey",
          "title": "Expert Survey",
          "used_for": "data_points"
        },
        {
          "url": "https://example.com/reddit",
          "title": "Reddit Discussion",
          "used_for": "audience_insights"
        },
        {
          "url": "https://example.com/blog",
          "title": "Tech Blog",
          "used_for": "landscape"
        }
      ]
    }
  },
  "style_playbook": "clean-professional"
}